text	label
[PERSON] , Thanks for the message , and I apologize for the fact that I have n't sent you any presentation materials as I had originally promised .	send_presentation_provide
If possible , i can have him send you his resume .	send_resume_provide
SHould I just list our customers / partners , or try to send the slides seperately ? L	send_presentation_provide
Just wanted to close the loop - I sent him the presentation and reviewed it with him over the phone .	send_presentation_provide
Send me a note if you want to change the primary / secondary reviewers .	send_review_request
I will send you a presentation separately .	send_presentation_provide
I will be sending you a meeting request along with an agenda attached .	send_meeting_request_provide
Technologic sent me a fax today reminding me that the photograph needs to be sent right away .	send_fax_request
I will send a powerpoint presentation to you next week .	send_presentation_provide
"When you 're ready to send a fax , simply drag and drop these thumbnails to your j2 Fax icon on the [LOCATION] "" Links Bar "" , and you 're done !"	send_fax_request
If you could just send along the photo I will e - mail it on to my editors .	send_pictures_provide
* * * Please do not send EMAIL for changes - This may delay service !	send_update_changes_request
Hi All , Can someone send out the feedback forms ? Thanks , [PERSON]	send_review_provide
[PERSON] , Yes , please send these presentations to [PERSON] and myself and let us know when you need us to get back to you .	send_presentation_request
I 'll send his resume after I do some editing ...	send_resume_provide
[PERSON] , Please continue to send the customer updates as usual .	send_update_changes_request
If you are unable to access the presentation via the web link or previously sent .pdf attachment , please contact client services at inquiry@metagroup.com or ( 203 ) 973 - 6700 for assistance . Regards , [PERSON] [PERSON] META Group Client Services Manager ( 203 ) 973 - 6812 jackie.coralian@metagroup.com www.metagroup.com	send_presentation_request
[PERSON] will be sending to us another version with our comments and other additional changes / information on Sunday by 5 pm our time .	send_update_changes_request
I want to send my resume to you .. kaya [PERSON] [PERSON] [PERSON] [PERSON] [PERSON] [PERSON] ...	send_resume_provide
I sent these pictures to [PERSON] , too . Love , --Dad _ _ _ _ _ Get more from the Web .	send_pictures_provide
I sent the presentation .	send_presentation_provide
I will be happy to send you the new slides , but I 'm afraid I will have to hold off until after the Forum -- there are quite a few new numbers that will be released at the Forum so I can not share the presentation outside the company until after the event - is that OK with you ?	send_presentation_provide
I will send you the presentation with their logo inserted .	send_presentation_provide
Do you really want me to start sending M emails with kitty pictures ?	send_pictures_request
Please send your updated presentation to me directly by end of day Monday at the latest .	send_presentation_request
Send us your best beach photograph , and we 'll select a few for publication in our next issue .	send_pictures_request
It will take little bit time ( may be a week or 10 days ) for me to send you the resume , If that 's OK with you .	send_resume_request
I will send you instructions on how to join in on the Web - ex presentation soon .	send_presentation_provide
I ca n't stress the importance of a review cycle enough when sending information out to customers .	send_review_provide
[PERSON] , I am sending you [PERSON] 's mobile picture .	send_pictures_provide
We agreed that I send to you 2 presentations first thing in the morning this Monday .	send_presentation_provide
[PERSON] , Could you please send the HP seminar presentation slides to [PERSON] [PERSON] at HP for Georgia Pacific .	send_presentation_request
Just a reminder to send your slides to the appropriately names mailbox SLIDES@dci.com on ( or , of course , before ) Monday August 7th .	send_presentation_request
Hey [PERSON] , I have been sending out resumes and meeting with people to try and secure a new position .	send_resume_provide
Once I get into the hotel , I will send over a recent Powerpoint presentation given to an Accenture audience so that [PERSON] and [PERSON] can get a sense of our messaging and joint activity .	send_presentation_provide
Hi [PERSON] , Can you send the other pictures that we modified .	send_pictures_provide
I will send the 4.0 UI slides for [PERSON] to go over with you .	send_presentation_provide
thanks [PERSON] . please send me your presentation upon completion .	send_presentation_request
Since we are under a non - disclosure , I will send the full PowerPoint presentation from yesterday when I return to my office and get high speed access .	send_presentation_provide
I will be sending out meeting requests within 5 minutes .	send_meeting_request_provide
Please send me PPT slide with autorun by Friday evening your time .	send_presentation_request
Please send the slides on the following topics : Profesional Services ( App Dev , Maintinence , Mentoring , consultatinon , etc)- [PERSON] with input from [PERSON] [PERSON] [PERSON] [PERSON] [PERSON] [PERSON] [PERSON] [PERSON] [PERSON] [PERSON] [PERSON] ( App Maintainence , UI design , etc ) - Divakar When we collate the presentation we may group the services of the IDC with PS so that it is not visable to the customer where the services are performed .	send_presentation_provide
Please send your resumes Mr. [PERSON] [PERSON] on 3745051 . Thanks , [PERSON]	send_resume_request
